[
  {
    "command_id": "550e8400-e29b-41d4-a716-446655440000",
    "action_type": "config_change",
    "target": "iris.cpf",
    "parameters": {
      "section": "Startup",
      "key": "globals",
      "value": "20000"
    },
    "priority": "high",
    "requester": "monitoring-system"
  },
  {
    "command_id": "550e8400-e29b-41d4-a716-446655440001",
    "action_type": "os_reconfig",
    "target": "hugepages",
    "parameters": {
      "resource_type": "memory",
      "target_value": 16384
    },
    "priority": "medium",
    "requester": "ops-automation"
  },
  {
    "command_id": "550e8400-e29b-41d4-a716-446655440002",
    "action_type": "restart",
    "target": "instance",
    "parameters": {
      "mode": "graceful",
      "timeout_seconds": 60
    },
    "priority": "high",
    "requester": "maintenance-system"
  }
]
